{"$id":"https://github.com/martin-beck/agent-workflow-quality/schemas/release-trust-policy.schema.json","$schema":"https://json-schema.org/draft/2020-12/schema","additionalProperties":false,"allOf":[{"else":{"properties":{"previous_policy_sha256":{"pattern":"^[a-f0-9]{64}$","type":"string"}}},"if":{"properties":{"generation":{"const":1}}},"then":{"properties":{"previous_policy_sha256":{"type":"null"}}}}],"properties":{"generation":{"maximum":1000,"minimum":1,"type":"integer"},"previous_policy_sha256":{"oneOf":[{"type":"null"},{"pattern":"^[a-f0-9]{64}$","type":"string"}]},"repository":{"const":"https://github.com/martin-beck/agent-workflow-quality"},"retired":{"items":{"pattern":"^SHA256:[A-Za-z0-9+/]{43}$","type":"string"},"maxItems":1000,"type":"array","uniqueItems":true},"roots":{"items":{"additionalProperties":false,"properties":{"fingerprint":{"pattern":"^SHA256:[A-Za-z0-9+/]{43}$","type":"string"},"principal":{"pattern":"^[A-Za-z0-9][A-Za-z0-9_.@+-]{0,127}$","type":"string"},"public_key":{"pattern":"^ssh-ed25519 [A-Za-z0-9+/]{68}$","type":"string"},"valid_after":{"format":"date-time","pattern":"^[0-9]{4}-[0-9]{2}-[0-9]{2}T[0-9]{2}:[0-9]{2}:[0-9]{2}Z$","type":"string"},"valid_until":{"format":"date-time","pattern":"^[0-9]{4}-[0-9]{2}-[0-9]{2}T[0-9]{2}:[0-9]{2}:[0-9]{2}Z$","type":"string"}},"required":["principal","public_key","fingerprint","valid_after","valid_until"],"type":"object"},"maxItems":8,"minItems":1,"type":"array","uniqueItems":true},"schema_version":{"const":1}},"required":["schema_version","repository","generation","previous_policy_sha256","roots","retired"],"type":"object"}
