{"generation":1,"previous_policy_sha256":null,"repository":"https://github.com/martin-beck/agent-workflow-quality","retired":[],"roots":[{"fingerprint":"SHA256:ZkAslGjFiUHdGf/WUL8rQvkib4PTvQatUV0OUQSncCA","principal":"synthetic-example@example.invalid","public_key":"ssh-ed25519 AAAAC3NzaC1lZDI1NTE5AAAAIAABAgMEBQYHCAkKCwwNDg8QERITFBUWFxgZGhscHR4f","valid_after":"2020-01-01T00:00:00Z","valid_until":"2090-01-01T00:00:00Z"}],"schema_version":1}
